{
  "$schema": "https://json-schema.org/draft/2020-12/schema",
  "$id": "https://pathfinder.local/schemas/mission/host-action-receipt.schema.json",
  "title": "Pathfinder Host Action Receipt",
  "type": "object", "additionalProperties": false,
  "required": ["schema_version", "action_id", "operation_id", "mission_id", "attempt_id", "action_kind", "request_sha256", "authorization_snapshot_sha256", "runtime_boundary_sha256", "outcome", "evidence", "completed_at"],
  "properties": {
    "schema_version": {"const": 1},
    "action_id": {"type": "string", "pattern": "^action_[a-z0-9][a-z0-9_-]{7,63}$"},
    "operation_id": {"type": "string", "pattern": "^operation_[a-z0-9][a-z0-9_-]{7,63}$"},
    "mission_id": {"type": "string", "pattern": "^mission_[a-z0-9][a-z0-9_-]{7,63}$"},
    "attempt_id": {"type": "string", "pattern": "^attempt_[a-z0-9][a-z0-9_-]{7,63}$"},
    "action_kind": {"enum": ["prepare-worktree", "activate-goal", "implement", "verify", "commit", "publish"]},
    "request_sha256": {"type": "string", "pattern": "^[0-9a-f]{64}$"},
    "authorization_snapshot_sha256": {"type": "string", "pattern": "^[0-9a-f]{64}$"},
    "runtime_boundary_sha256": {"type": "string", "pattern": "^[0-9a-f]{64}$"},
    "outcome": {"enum": ["succeeded", "failed", "manual-handoff", "not-observed", "reconcile-required"]},
    "evidence": {"$ref": "#/$defs/evidence"},
    "completed_at": {"type": "string", "format": "date-time"}
  },
  "$defs": {
    "evidence": {
      "type": "object", "additionalProperties": false,
      "required": ["code", "redacted_summary", "stable_id", "artifact_sha256", "exit_status", "changed_files"],
      "properties": {
        "code": {"enum": ["worktree-prepared", "goal-active", "implementation-complete", "verification-passed", "verification-failed", "commit-created", "publication-complete", "manual-handoff", "action-failed", "not-found", "ambiguous"]},
        "redacted_summary": {"type": "string", "maxLength": 2000},
        "stable_id": {"type": ["string", "null"], "pattern": "^[A-Za-z0-9][A-Za-z0-9._:/#-]{0,255}$"},
        "artifact_sha256": {"type": ["string", "null"], "pattern": "^[0-9a-f]{64}$"},
        "exit_status": {"type": ["integer", "null"]},
        "changed_files": {"type": "array", "items": {"type": "string", "minLength": 1, "maxLength": 512}, "maxItems": 1000, "uniqueItems": true}
      }
    }
  }
}
