{
  "schema_version": 1,
  "action_id": "action_12345678",
  "operation_id": "operation_12345678",
  "mission_id": "mission_12345678",
  "attempt_id": "attempt_12345678",
  "action_kind": "activate-goal",
  "request_sha256": "aaaaaaaaaaaaaaaaaaaaaaaaaaaaaaaaaaaaaaaaaaaaaaaaaaaaaaaaaaaaaaaa",
  "authorization_snapshot_sha256": "bbbbbbbbbbbbbbbbbbbbbbbbbbbbbbbbbbbbbbbbbbbbbbbbbbbbbbbbbbbbbbbb",
  "runtime_boundary_sha256": "cccccccccccccccccccccccccccccccccccccccccccccccccccccccccccccccc",
  "outcome": "succeeded",
  "evidence": {"code": "goal-active", "redacted_summary": "native Goal active", "stable_id": "goal_native_12345678", "artifact_sha256": null, "exit_status": null, "changed_files": []},
  "completed_at": "2026-08-10T12:01:00+00:00"
}
